{"standard":"vibori-election-result/v1","source":{"url":"http://apps.cikrf.ru/service/ik-inp-service-pbcopy/reports/242?commissionClassifierId=73ce947b-b000-4bf8-b238-d2c42ad2c0a4&protocolNum=1","retrieved_at":"2026-09-22T06:50:16.877679+00:00","publisher":"Central Election Commission of Russia"},"election":{"id":"izbirkom-587813923-p1","name":"Выборы депутатов Государственной Думы Федерального Собрания Российской Федерации девятого созыва","country":"RU","date":"2026-09-20","scope":"national"},"unit":{"id":"73ce947b-b000-4bf8-b238-d2c42ad2c0a4","name":"УИК №185","number":"185","kind":"precinct","administrative_path":[{"id":"f0130cef-663a-4c57-b8ff-17054f8fa34e","name":"ЦИК России","kind":"national"},{"id":"f5ff7022-aca4-478a-8355-12de0265dcd6","name":"Курганская область","kind":"region"},{"id":"430c0507-7cab-4db5-a6c3-75eac9f98e25","name":"Курганская область – Курганский","kind":"district"},{"id":"e2472b15-a79e-4a60-b783-eab42ceeddec","name":"Каргапольская","kind":"territorial_commission"}]},"ballot":{"id":"protocol-1","title":"Выборы депутатов Государственной Думы Федерального Собрания Российской Федерации девятого созыва","kind":"single_member"},"turnout":{"registered":760,"issued":460,"valid":460,"invalid":0},"results":[{"entity":{"id":"entity-54b9f34f1a","name":"Вагин Павел Юрьевич","type":"candidate"},"votes":57},{"entity":{"id":"entity-79bb0c4cb8","name":"Державин Валерий Владимирович","type":"candidate"},"votes":24},{"entity":{"id":"entity-224dfab49d","name":"Зырянов Виктор Леонидович","type":"candidate"},"votes":57},{"entity":{"id":"entity-db8b7a5996","name":"Ильтяков Александр Владимирович","type":"candidate"},"votes":241},{"entity":{"id":"entity-dbab3b3022","name":"Климко Ярослав Олегович","type":"candidate"},"votes":17},{"entity":{"id":"entity-1d68076fe9","name":"Панова Елена Валерьевна","type":"candidate"},"votes":26},{"entity":{"id":"entity-144bcf15a2","name":"Тропина Ксения Владимировна","type":"candidate"},"votes":38}]}
