{"standard":"vibori-election-result/v1","source":{"url":"http://apps.cikrf.ru/service/ik-inp-service-pbcopy/reports/242?commissionClassifierId=496fd646-1127-450a-85bd-80e4f3216b09&protocolNum=1","retrieved_at":"2026-09-22T06:16:47.527078+00:00","publisher":"Central Election Commission of Russia"},"election":{"id":"izbirkom-587813923-p1","name":"Выборы депутатов Государственной Думы Федерального Собрания Российской Федерации девятого созыва","country":"RU","date":"2026-09-20","scope":"national"},"unit":{"id":"496fd646-1127-450a-85bd-80e4f3216b09","name":"УИК №326","number":"326","kind":"precinct","administrative_path":[{"id":"f0130cef-663a-4c57-b8ff-17054f8fa34e","name":"ЦИК России","kind":"national"},{"id":"70576a06-4939-4454-a345-8c9317ae32da","name":"Красноярский край","kind":"region"},{"id":"0775b171-13fa-4029-807c-73ba11055366","name":"Красноярский край – Дивногорский","kind":"district"},{"id":"8b452755-a05d-4268-be51-21582529bf88","name":"Территориальная избирательная комиссия Октябрьского района города Красноярска","kind":"territorial_commission"}]},"ballot":{"id":"protocol-1","title":"Выборы депутатов Государственной Думы Федерального Собрания Российской Федерации девятого созыва","kind":"single_member"},"turnout":{"registered":1779,"issued":758,"valid":730,"invalid":28},"results":[{"entity":{"id":"entity-48d96400af","name":"Бразаускас Денис Владимирович","type":"candidate"},"votes":32},{"entity":{"id":"entity-f6ef25a12b","name":"Гаврилов Григорий Сергеевич","type":"candidate"},"votes":77},{"entity":{"id":"entity-23d32d12ca","name":"Дюков Вячеслав Игоревич","type":"candidate"},"votes":55},{"entity":{"id":"entity-270057ac6c","name":"Еремин Сергей Васильевич","type":"candidate"},"votes":265},{"entity":{"id":"entity-e65b06d19d","name":"Исаев Валерий Андреевич","type":"candidate"},"votes":138},{"entity":{"id":"entity-c8819c252e","name":"Костецкая Илона Игоревна","type":"candidate"},"votes":77},{"entity":{"id":"entity-3eaaef8d93","name":"Маркерт Максим Андреевич","type":"candidate"},"votes":30},{"entity":{"id":"entity-f953bc1e29","name":"Орда Михаил Сергеевич","type":"candidate"},"votes":38},{"entity":{"id":"entity-f568f6b2b0","name":"Попов Дмитрий Сергеевич","type":"candidate"},"votes":18}]}
