{"standard":"vibori-election-result/v1","source":{"url":"http://apps.cikrf.ru/service/ik-inp-service-pbcopy/reports/242?commissionClassifierId=01ad13d3-a286-45b9-979c-948fbb6956da&protocolNum=2","retrieved_at":"2026-09-22T06:56:16.145650+00:00","publisher":"Central Election Commission of Russia"},"election":{"id":"izbirkom-587813923-p2","name":"Выборы депутатов Государственной Думы Федерального Собрания Российской Федерации девятого созыва","country":"RU","date":"2026-09-20","scope":"national"},"unit":{"id":"01ad13d3-a286-45b9-979c-948fbb6956da","name":"УИК №778","number":"778","kind":"precinct","administrative_path":[{"id":"f0130cef-663a-4c57-b8ff-17054f8fa34e","name":"ЦИК России","kind":"national"},{"id":"6d4b7ab5-ead9-4b21-878f-e24386133210","name":"Московская область","kind":"region"},{"id":"869d48fd-89a9-42fd-a14e-f16709948b7f","name":"Московская область – Красногорский","kind":"district"},{"id":"a44ae4a9-133e-44d9-b081-32cfd445d9c9","name":"Истра (121 округ ГД)","kind":"territorial_commission"}]},"ballot":{"id":"protocol-2","title":"Выборы депутатов Государственной Думы Федерального Собрания Российской Федерации девятого созыва","kind":"party_list"},"turnout":{"registered":271,"issued":137,"valid":133,"invalid":4},"results":[{"entity":{"id":"entity-1aeb67396c","name":"Всероссийская политическая партия \"ЕДИНАЯ РОССИЯ\"","type":"party"},"votes":88},{"entity":{"id":"entity-ce328b748b","name":"Политическая партия ЛДПР – Либерально-демократическая партия России","type":"party"},"votes":12},{"entity":{"id":"entity-816dbdcac1","name":"Политическая партия \"Партия прямой демократии\"","type":"party"},"votes":3},{"entity":{"id":"entity-dcb6a1e469","name":"Политическая партия \"Российская экологическая партия \"ЗЕЛЁНЫЕ\"","type":"party"},"votes":1},{"entity":{"id":"entity-7b5a5a2fbc","name":"Социалистическая политическая партия СПРАВЕДЛИВАЯ РОССИЯ","type":"party"},"votes":1},{"entity":{"id":"entity-81c0411012","name":"ВСЕРОССИЙСКАЯ ПОЛИТИЧЕСКАЯ ПАРТИЯ \"РОДИНА\"","type":"party"},"votes":2},{"entity":{"id":"entity-a60eed222f","name":"КПРФ - политическая партия КОММУНИСТИЧЕСКАЯ ПАРТИЯ РОССИЙСКОЙ ФЕДЕРАЦИИ","type":"party"},"votes":14},{"entity":{"id":"entity-33ae0aa226","name":"ПАРТИЯ ПЕНСИОНЕРОВ","type":"party"},"votes":3},{"entity":{"id":"entity-8bbed421bf","name":"Политическая партия КОММУНИСТИЧЕСКАЯ ПАРТИЯ КОММУНИСТЫ РОССИИ","type":"party"},"votes":2},{"entity":{"id":"entity-4f0a129b6e","name":"Политическая партия \"НОВЫЕ ЛЮДИ\"","type":"party"},"votes":7}]}
