{"standard":"vibori-election-result/v1","source":{"url":"http://apps.cikrf.ru/service/ik-inp-service-pbcopy/reports/242?commissionClassifierId=99eb890e-60a3-4ae8-9ae2-23eb8feb60a4&protocolNum=1","retrieved_at":"2026-09-22T07:18:43.766529+00:00","publisher":"Central Election Commission of Russia"},"election":{"id":"izbirkom-587813923-p1","name":"Выборы депутатов Государственной Думы Федерального Собрания Российской Федерации девятого созыва","country":"RU","date":"2026-09-20","scope":"national"},"unit":{"id":"99eb890e-60a3-4ae8-9ae2-23eb8feb60a4","name":"УИК №2267","number":"2267","kind":"precinct","administrative_path":[{"id":"f0130cef-663a-4c57-b8ff-17054f8fa34e","name":"ЦИК России","kind":"national"},{"id":"6131d413-1e98-404f-81bd-836968da1a15","name":"Ростовская область","kind":"region"},{"id":"1da1a446-fa1b-47d7-98d4-294dac44b810","name":"Ростовская область – Неклиновский","kind":"district"},{"id":"76795004-acb4-431d-a3fa-f1c5a040400d","name":"Таганрогская городская (западная)","kind":"territorial_commission"}]},"ballot":{"id":"protocol-1","title":"Выборы депутатов Государственной Думы Федерального Собрания Российской Федерации девятого созыва","kind":"single_member"},"turnout":{"registered":899,"issued":586,"valid":564,"invalid":12},"results":[{"entity":{"id":"entity-b6ffde5980","name":"Величко Артем Николаевич","type":"candidate"},"votes":263},{"entity":{"id":"entity-c9e27ee9eb","name":"Мирошников Виталий Михайлович","type":"candidate"},"votes":38},{"entity":{"id":"entity-43868b901e","name":"Павленко Татьяна Эдуардовна","type":"candidate"},"votes":60},{"entity":{"id":"entity-5f38d15364","name":"Фомин Виталий Анатольевич","type":"candidate"},"votes":26},{"entity":{"id":"entity-b26044f85d","name":"Хижняк Евгений Анатольевич","type":"candidate"},"votes":87},{"entity":{"id":"entity-1366863bae","name":"Шаляев Алексей Викторович","type":"candidate"},"votes":18},{"entity":{"id":"entity-402fae70cd","name":"Шаповалов Сергей Александрович","type":"candidate"},"votes":72}]}
