{"standard":"vibori-election-result/v1","source":{"url":"http://apps.cikrf.ru/service/ik-inp-service-pbcopy/reports/242?commissionClassifierId=a10ccd8b-c7a3-46db-b237-03d958d38e65&protocolNum=2","retrieved_at":"2026-09-22T07:17:03.920944+00:00","publisher":"Central Election Commission of Russia"},"election":{"id":"izbirkom-587813923-p2","name":"Выборы депутатов Государственной Думы Федерального Собрания Российской Федерации девятого созыва","country":"RU","date":"2026-09-20","scope":"national"},"unit":{"id":"a10ccd8b-c7a3-46db-b237-03d958d38e65","name":"УИК №2006","number":"2006","kind":"precinct","administrative_path":[{"id":"f0130cef-663a-4c57-b8ff-17054f8fa34e","name":"ЦИК России","kind":"national"},{"id":"6131d413-1e98-404f-81bd-836968da1a15","name":"Ростовская область","kind":"region"},{"id":"3712aeb2-5d88-456e-aaea-6bc766bb2046","name":"Ростовская область – Ростовский","kind":"district"},{"id":"83171895-f983-461d-a2e0-a2c7d9c7e9e4","name":"Ростов-на-Дону, Советская","kind":"territorial_commission"}]},"ballot":{"id":"protocol-2","title":"Выборы депутатов Государственной Думы Федерального Собрания Российской Федерации девятого созыва","kind":"party_list"},"turnout":{"registered":2599,"issued":740,"valid":737,"invalid":3},"results":[{"entity":{"id":"entity-1aeb67396c","name":"Всероссийская политическая партия \"ЕДИНАЯ РОССИЯ\"","type":"party"},"votes":421},{"entity":{"id":"entity-ce328b748b","name":"Политическая партия ЛДПР – Либерально-демократическая партия России","type":"party"},"votes":89},{"entity":{"id":"entity-816dbdcac1","name":"Политическая партия \"Партия прямой демократии\"","type":"party"},"votes":5},{"entity":{"id":"entity-dcb6a1e469","name":"Политическая партия \"Российская экологическая партия \"ЗЕЛЁНЫЕ\"","type":"party"},"votes":4},{"entity":{"id":"entity-7b5a5a2fbc","name":"Социалистическая политическая партия СПРАВЕДЛИВАЯ РОССИЯ","type":"party"},"votes":29},{"entity":{"id":"entity-81c0411012","name":"ВСЕРОССИЙСКАЯ ПОЛИТИЧЕСКАЯ ПАРТИЯ \"РОДИНА\"","type":"party"},"votes":6},{"entity":{"id":"entity-a60eed222f","name":"КПРФ - политическая партия КОММУНИСТИЧЕСКАЯ ПАРТИЯ РОССИЙСКОЙ ФЕДЕРАЦИИ","type":"party"},"votes":105},{"entity":{"id":"entity-33ae0aa226","name":"ПАРТИЯ ПЕНСИОНЕРОВ","type":"party"},"votes":5},{"entity":{"id":"entity-8bbed421bf","name":"Политическая партия КОММУНИСТИЧЕСКАЯ ПАРТИЯ КОММУНИСТЫ РОССИИ","type":"party"},"votes":6},{"entity":{"id":"entity-4f0a129b6e","name":"Политическая партия \"НОВЫЕ ЛЮДИ\"","type":"party"},"votes":67}]}
