{"standard":"vibori-election-result/v1","source":{"url":"http://apps.cikrf.ru/service/ik-inp-service-pbcopy/reports/242?commissionClassifierId=7b9a2bf8-4376-42c7-9a02-7e89dce7f850&protocolNum=2","retrieved_at":"2026-09-22T07:42:56.677568+00:00","publisher":"Central Election Commission of Russia"},"election":{"id":"izbirkom-587813923-p2","name":"Выборы депутатов Государственной Думы Федерального Собрания Российской Федерации девятого созыва","country":"RU","date":"2026-09-20","scope":"national"},"unit":{"id":"7b9a2bf8-4376-42c7-9a02-7e89dce7f850","name":"УИК №2038","number":"2038","kind":"precinct","administrative_path":[{"id":"f0130cef-663a-4c57-b8ff-17054f8fa34e","name":"ЦИК России","kind":"national"},{"id":"40212be9-00c5-4c0a-b738-f86510fdedce","name":"Челябинская область","kind":"region"},{"id":"21eb94d3-a0d3-468d-9932-fa8b22521e96","name":"Челябинская область – Коркинский","kind":"district"},{"id":"9c08146c-60a5-4794-8a58-f72fe8c43bc7","name":"Челябинск, Ленинская","kind":"territorial_commission"}]},"ballot":{"id":"protocol-2","title":"Выборы депутатов Государственной Думы Федерального Собрания Российской Федерации девятого созыва","kind":"party_list"},"turnout":{"registered":2432,"issued":958,"valid":939,"invalid":19},"results":[{"entity":{"id":"entity-1aeb67396c","name":"Всероссийская политическая партия \"ЕДИНАЯ РОССИЯ\"","type":"party"},"votes":431},{"entity":{"id":"entity-ce328b748b","name":"Политическая партия ЛДПР – Либерально-демократическая партия России","type":"party"},"votes":41},{"entity":{"id":"entity-816dbdcac1","name":"Политическая партия \"Партия прямой демократии\"","type":"party"},"votes":3},{"entity":{"id":"entity-dcb6a1e469","name":"Политическая партия \"Российская экологическая партия \"ЗЕЛЁНЫЕ\"","type":"party"},"votes":11},{"entity":{"id":"entity-7b5a5a2fbc","name":"Социалистическая политическая партия СПРАВЕДЛИВАЯ РОССИЯ","type":"party"},"votes":165},{"entity":{"id":"entity-81c0411012","name":"ВСЕРОССИЙСКАЯ ПОЛИТИЧЕСКАЯ ПАРТИЯ \"РОДИНА\"","type":"party"},"votes":4},{"entity":{"id":"entity-a60eed222f","name":"КПРФ - политическая партия КОММУНИСТИЧЕСКАЯ ПАРТИЯ РОССИЙСКОЙ ФЕДЕРАЦИИ","type":"party"},"votes":159},{"entity":{"id":"entity-33ae0aa226","name":"ПАРТИЯ ПЕНСИОНЕРОВ","type":"party"},"votes":32},{"entity":{"id":"entity-8bbed421bf","name":"Политическая партия КОММУНИСТИЧЕСКАЯ ПАРТИЯ КОММУНИСТЫ РОССИИ","type":"party"},"votes":8},{"entity":{"id":"entity-4f0a129b6e","name":"Политическая партия \"НОВЫЕ ЛЮДИ\"","type":"party"},"votes":85}]}
