{"standard":"vibori-election-result/v1","source":{"url":"http://apps.cikrf.ru/service/ik-inp-service-pbcopy/reports/242?commissionClassifierId=7a901d67-8be3-451a-857f-1c17f0535d2e&protocolNum=1","retrieved_at":"2026-09-22T06:24:08.355249+00:00","publisher":"Central Election Commission of Russia"},"election":{"id":"izbirkom-587813923-p1","name":"Выборы депутатов Государственной Думы Федерального Собрания Российской Федерации девятого созыва","country":"RU","date":"2026-09-20","scope":"national"},"unit":{"id":"7a901d67-8be3-451a-857f-1c17f0535d2e","name":"УИК №1031","number":"1031","kind":"precinct","administrative_path":[{"id":"f0130cef-663a-4c57-b8ff-17054f8fa34e","name":"ЦИК России","kind":"national"},{"id":"1b05150b-35ea-465f-93fc-244d71dc1877","name":"Ставропольский край","kind":"region"},{"id":"be866124-d17b-471f-9fe0-5ba16cba9874","name":"Ставропольский край – Кавминводский","kind":"district"},{"id":"645c1e5a-9bb7-4114-9010-e955d33516dd","name":"Предгорная","kind":"territorial_commission"}]},"ballot":{"id":"protocol-1","title":"Выборы депутатов Государственной Думы Федерального Собрания Российской Федерации девятого созыва","kind":"single_member"},"turnout":{"registered":311,"issued":246,"valid":242,"invalid":4},"results":[{"entity":{"id":"entity-45943db9e5","name":"Авдеев Василий Геннадьевич","type":"candidate"},"votes":15},{"entity":{"id":"entity-4f99d24018","name":"Воробьев Сергей Борисович","type":"candidate"},"votes":25},{"entity":{"id":"entity-d0408040b4","name":"Дроздов Илья Юрьевич","type":"candidate"},"votes":121},{"entity":{"id":"entity-9ecc89bdde","name":"Жуков Андрей Владимирович","type":"candidate"},"votes":17},{"entity":{"id":"entity-5a42c4083e","name":"Захаренков Артемий Викторович","type":"candidate"},"votes":10},{"entity":{"id":"entity-24593962b1","name":"Сердюков Андрей Иванович","type":"candidate"},"votes":34},{"entity":{"id":"entity-a574c7905a","name":"Шпунт Олег Эдуардович","type":"candidate"},"votes":10},{"entity":{"id":"entity-3e6f1e88eb","name":"Штымов Астемир Каральбиевич","type":"candidate"},"votes":10}]}
