{"standard":"vibori-election-result/v1","source":{"url":"http://apps.cikrf.ru/service/ik-inp-service-pbcopy/reports/242?commissionClassifierId=d1c8d1ec-e1c9-458a-a43e-af3d16235f11&protocolNum=2","retrieved_at":"2026-09-22T06:18:30.625190+00:00","publisher":"Central Election Commission of Russia"},"election":{"id":"izbirkom-587813923-p2","name":"Выборы депутатов Государственной Думы Федерального Собрания Российской Федерации девятого созыва","country":"RU","date":"2026-09-20","scope":"national"},"unit":{"id":"d1c8d1ec-e1c9-458a-a43e-af3d16235f11","name":"УИК №2813","number":"2813","kind":"precinct","administrative_path":[{"id":"f0130cef-663a-4c57-b8ff-17054f8fa34e","name":"ЦИК России","kind":"national"},{"id":"9a542082-c86a-42a2-a2c9-8ffe74737c00","name":"Пермский край","kind":"region"},{"id":"ac5c0d1d-471a-4c9c-b116-35f96e94983d","name":"Пермский край – Пермский","kind":"district"},{"id":"464202b6-9601-4e2e-ad81-4b13051ca2ea","name":"Пермь, Дзержинская","kind":"territorial_commission"}]},"ballot":{"id":"protocol-2","title":"Выборы депутатов Государственной Думы Федерального Собрания Российской Федерации девятого созыва","kind":"party_list"},"turnout":{"registered":1743,"issued":611,"valid":596,"invalid":15},"results":[{"entity":{"id":"entity-1aeb67396c","name":"Всероссийская политическая партия \"ЕДИНАЯ РОССИЯ\"","type":"party"},"votes":201},{"entity":{"id":"entity-ce328b748b","name":"Политическая партия ЛДПР – Либерально-демократическая партия России","type":"party"},"votes":62},{"entity":{"id":"entity-816dbdcac1","name":"Политическая партия \"Партия прямой демократии\"","type":"party"},"votes":6},{"entity":{"id":"entity-dcb6a1e469","name":"Политическая партия \"Российская экологическая партия \"ЗЕЛЁНЫЕ\"","type":"party"},"votes":14},{"entity":{"id":"entity-7b5a5a2fbc","name":"Социалистическая политическая партия СПРАВЕДЛИВАЯ РОССИЯ","type":"party"},"votes":40},{"entity":{"id":"entity-81c0411012","name":"ВСЕРОССИЙСКАЯ ПОЛИТИЧЕСКАЯ ПАРТИЯ \"РОДИНА\"","type":"party"},"votes":10},{"entity":{"id":"entity-a60eed222f","name":"КПРФ - политическая партия КОММУНИСТИЧЕСКАЯ ПАРТИЯ РОССИЙСКОЙ ФЕДЕРАЦИИ","type":"party"},"votes":111},{"entity":{"id":"entity-33ae0aa226","name":"ПАРТИЯ ПЕНСИОНЕРОВ","type":"party"},"votes":26},{"entity":{"id":"entity-8bbed421bf","name":"Политическая партия КОММУНИСТИЧЕСКАЯ ПАРТИЯ КОММУНИСТЫ РОССИИ","type":"party"},"votes":8},{"entity":{"id":"entity-4f0a129b6e","name":"Политическая партия \"НОВЫЕ ЛЮДИ\"","type":"party"},"votes":118}]}
