{"standard":"vibori-election-result/v1","source":{"url":"http://apps.cikrf.ru/service/ik-inp-service-pbcopy/reports/242?commissionClassifierId=eae00a64-8223-4d44-90fb-0a90643ffafa&protocolNum=1","retrieved_at":"2026-09-22T06:09:24.644533+00:00","publisher":"Central Election Commission of Russia"},"election":{"id":"izbirkom-587813923-p1","name":"Выборы депутатов Государственной Думы Федерального Собрания Российской Федерации девятого созыва","country":"RU","date":"2026-09-20","scope":"national"},"unit":{"id":"eae00a64-8223-4d44-90fb-0a90643ffafa","name":"УИК №141","number":"141","kind":"precinct","administrative_path":[{"id":"f0130cef-663a-4c57-b8ff-17054f8fa34e","name":"ЦИК России","kind":"national"},{"id":"cd957772-4ab3-4755-90cd-595c618272d5","name":"Забайкальский край","kind":"region"},{"id":"ae7e87c3-8b98-4492-b4db-6c6b13cd8705","name":"Забайкальский край – Забайкальский","kind":"district"},{"id":"b6d4e13e-dae1-4115-bcc7-44e09bfb1a36","name":"Центральная г. Читы","kind":"territorial_commission"}]},"ballot":{"id":"protocol-1","title":"Выборы депутатов Государственной Думы Федерального Собрания Российской Федерации девятого созыва","kind":"single_member"},"turnout":{"registered":759,"issued":757,"valid":754,"invalid":3},"results":[{"entity":{"id":"entity-0791254ccd","name":"Григорьев Александр Андреевич","type":"candidate"},"votes":4},{"entity":{"id":"entity-cce3eafe25","name":"Григорьев Юрий Иннокентьевич","type":"candidate"},"votes":5},{"entity":{"id":"entity-3686368407","name":"Жданов Александр Валерьевич","type":"candidate"},"votes":9},{"entity":{"id":"entity-e8441cf79f","name":"Кадиров Александр Викторович","type":"candidate"},"votes":9},{"entity":{"id":"entity-0279c03665","name":"Мурзова Ольга Михайловна","type":"candidate"},"votes":8},{"entity":{"id":"entity-873031a4cb","name":"Праницкий-Кантемир Владимир Иванович","type":"candidate"},"votes":9},{"entity":{"id":"entity-e44367af7c","name":"Секержитская Марина Анатольевна","type":"candidate"},"votes":690},{"entity":{"id":"entity-29c9b332e7","name":"Селяев Павел Валерьевич","type":"candidate"},"votes":8},{"entity":{"id":"entity-0367a73201","name":"Шибаева Мария Александровна","type":"candidate"},"votes":2},{"entity":{"id":"entity-72c2e0cf8f","name":"Шипицын Максим Владимирович","type":"candidate"},"votes":10}]}
