{"standard":"vibori-election-result/v1","source":{"url":"http://apps.cikrf.ru/service/ik-inp-service-pbcopy/reports/242?commissionClassifierId=c459ff75-9543-403a-aa46-f0a6298ae0eb&protocolNum=2","retrieved_at":"2026-09-22T07:37:21.161895+00:00","publisher":"Central Election Commission of Russia"},"election":{"id":"izbirkom-587813923-p2","name":"Выборы депутатов Государственной Думы Федерального Собрания Российской Федерации девятого созыва","country":"RU","date":"2026-09-20","scope":"national"},"unit":{"id":"c459ff75-9543-403a-aa46-f0a6298ae0eb","name":"УИК №2410","number":"2410","kind":"precinct","administrative_path":[{"id":"f0130cef-663a-4c57-b8ff-17054f8fa34e","name":"ЦИК России","kind":"national"},{"id":"601324c7-73cd-4e6e-865e-519064d2d3e4","name":"Тульская область","kind":"region"},{"id":"544aede7-a2ec-4775-be29-dc09886c0dd4","name":"Тульская область – Тульский","kind":"district"},{"id":"4e6e7483-f250-4d0d-bf8c-4eb75ccdc1f0","name":"Тула, Советская","kind":"territorial_commission"}]},"ballot":{"id":"protocol-2","title":"Выборы депутатов Государственной Думы Федерального Собрания Российской Федерации девятого созыва","kind":"party_list"},"turnout":{"registered":1012,"issued":434,"valid":414,"invalid":8},"results":[{"entity":{"id":"entity-1aeb67396c","name":"Всероссийская политическая партия \"ЕДИНАЯ РОССИЯ\"","type":"party"},"votes":198},{"entity":{"id":"entity-ce328b748b","name":"Политическая партия ЛДПР – Либерально-демократическая партия России","type":"party"},"votes":43},{"entity":{"id":"entity-816dbdcac1","name":"Политическая партия \"Партия прямой демократии\"","type":"party"},"votes":2},{"entity":{"id":"entity-dcb6a1e469","name":"Политическая партия \"Российская экологическая партия \"ЗЕЛЁНЫЕ\"","type":"party"},"votes":3},{"entity":{"id":"entity-7b5a5a2fbc","name":"Социалистическая политическая партия СПРАВЕДЛИВАЯ РОССИЯ","type":"party"},"votes":29},{"entity":{"id":"entity-81c0411012","name":"ВСЕРОССИЙСКАЯ ПОЛИТИЧЕСКАЯ ПАРТИЯ \"РОДИНА\"","type":"party"},"votes":4},{"entity":{"id":"entity-a60eed222f","name":"КПРФ - политическая партия КОММУНИСТИЧЕСКАЯ ПАРТИЯ РОССИЙСКОЙ ФЕДЕРАЦИИ","type":"party"},"votes":78},{"entity":{"id":"entity-33ae0aa226","name":"ПАРТИЯ ПЕНСИОНЕРОВ","type":"party"},"votes":11},{"entity":{"id":"entity-8bbed421bf","name":"Политическая партия КОММУНИСТИЧЕСКАЯ ПАРТИЯ КОММУНИСТЫ РОССИИ","type":"party"},"votes":10},{"entity":{"id":"entity-4f0a129b6e","name":"Политическая партия \"НОВЫЕ ЛЮДИ\"","type":"party"},"votes":36}]}
