{"standard":"vibori-election-result/v1","source":{"url":"http://apps.cikrf.ru/service/ik-inp-service-pbcopy/reports/242?commissionClassifierId=7b328bd9-0d4c-4ddd-aa0d-6019fc1c4290&protocolNum=1","retrieved_at":"2026-09-22T07:06:36.428739+00:00","publisher":"Central Election Commission of Russia"},"election":{"id":"izbirkom-587813923-p1","name":"Выборы депутатов Государственной Думы Федерального Собрания Российской Федерации девятого созыва","country":"RU","date":"2026-09-20","scope":"national"},"unit":{"id":"7b328bd9-0d4c-4ddd-aa0d-6019fc1c4290","name":"УИК №1480","number":"1480","kind":"precinct","administrative_path":[{"id":"f0130cef-663a-4c57-b8ff-17054f8fa34e","name":"ЦИК России","kind":"national"},{"id":"9b7c8978-244e-4f39-b822-dfe0629d7b82","name":"Новосибирская область","kind":"region"},{"id":"0e6f7756-2096-40cd-a70c-cadd56e85ca6","name":"Новосибирская область – Центральный","kind":"district"},{"id":"01f9c68f-d8ef-4ba5-b0fc-0f5be7545c7f","name":"Дзержинский район города Новосибирска","kind":"territorial_commission"}]},"ballot":{"id":"protocol-1","title":"Выборы депутатов Государственной Думы Федерального Собрания Российской Федерации девятого созыва","kind":"single_member"},"turnout":{"registered":1663,"issued":479,"valid":466,"invalid":13},"results":[{"entity":{"id":"entity-ab361f4252","name":"Белова Ольга Викторовна","type":"candidate"},"votes":16},{"entity":{"id":"entity-d13136a0e6","name":"Брашнина Оксана Александровна","type":"candidate"},"votes":45},{"entity":{"id":"entity-8cab25e539","name":"Копылов Петр Андреевич","type":"candidate"},"votes":63},{"entity":{"id":"entity-0e4a93d2f9","name":"Липаткин Александр Васильевич","type":"candidate"},"votes":32},{"entity":{"id":"entity-f73d7498b2","name":"Лихачёва Кристина Алексеевна","type":"candidate"},"votes":12},{"entity":{"id":"entity-ba069531a4","name":"Прохоров Александр Геннадьевич","type":"candidate"},"votes":51},{"entity":{"id":"entity-05e8172457","name":"Савельев Дмитрий Иванович","type":"candidate"},"votes":141},{"entity":{"id":"entity-bb25c527fa","name":"Сулейманов Ренат Исмаилович","type":"candidate"},"votes":93},{"entity":{"id":"entity-54bd921a80","name":"Чубарцева Наталья Николаевна","type":"candidate"},"votes":13}]}
