{"standard":"vibori-election-result/v1","source":{"url":"http://apps.cikrf.ru/service/ik-inp-service-pbcopy/reports/242?commissionClassifierId=706c4d0b-d423-4aaa-a016-ac1c50e536dd&protocolNum=1","retrieved_at":"2026-09-22T06:49:16.628019+00:00","publisher":"Central Election Commission of Russia"},"election":{"id":"izbirkom-587813923-p1","name":"Выборы депутатов Государственной Думы Федерального Собрания Российской Федерации девятого созыва","country":"RU","date":"2026-09-20","scope":"national"},"unit":{"id":"706c4d0b-d423-4aaa-a016-ac1c50e536dd","name":"УИК №1089","number":"1089","kind":"precinct","administrative_path":[{"id":"f0130cef-663a-4c57-b8ff-17054f8fa34e","name":"ЦИК России","kind":"national"},{"id":"3e9b9391-e036-4556-8aeb-b0da4bc58358","name":"Кировская область","kind":"region"},{"id":"4f761cb4-be62-4def-b665-232f4100941b","name":"Кировская область – Кирово-Чепецкий","kind":"district"},{"id":"5d3006e5-6d55-4e7f-aebf-39958eb3de5b","name":"Уржумская","kind":"territorial_commission"}]},"ballot":{"id":"protocol-1","title":"Выборы депутатов Государственной Думы Федерального Собрания Российской Федерации девятого созыва","kind":"single_member"},"turnout":{"registered":186,"issued":156,"valid":150,"invalid":6},"results":[{"entity":{"id":"entity-bed12e3fe4","name":"Альминова Анна Александровна","type":"candidate"},"votes":19},{"entity":{"id":"entity-e1733e0d67","name":"Бадмаев Владимир Владимирович","type":"candidate"},"votes":5},{"entity":{"id":"entity-856ebf14ba","name":"Березин Андрей Олегович","type":"candidate"},"votes":91},{"entity":{"id":"entity-c5b9d663e0","name":"Кремлёв Михаил Вячеславович","type":"candidate"},"votes":10},{"entity":{"id":"entity-acd64d5b99","name":"Никулин Александр Николаевич","type":"candidate"},"votes":12},{"entity":{"id":"entity-60c24ba4dd","name":"Суслова Екатерина Викторовна","type":"candidate"},"votes":2},{"entity":{"id":"entity-85411dbd03","name":"Тырыкина Ольга Евгеньевна","type":"candidate"},"votes":11}]}
