{"standard":"vibori-election-result/v1","source":{"url":"http://apps.cikrf.ru/service/ik-inp-service-pbcopy/reports/242?commissionClassifierId=1a5ee1b5-1f1e-4203-816a-fc6becfd39a3&protocolNum=1","retrieved_at":"2026-09-22T06:35:14.521855+00:00","publisher":"Central Election Commission of Russia"},"election":{"id":"izbirkom-587813923-p1","name":"Выборы депутатов Государственной Думы Федерального Собрания Российской Федерации девятого созыва","country":"RU","date":"2026-09-20","scope":"national"},"unit":{"id":"1a5ee1b5-1f1e-4203-816a-fc6becfd39a3","name":"УИК №3720","number":"3720","kind":"precinct","administrative_path":[{"id":"f0130cef-663a-4c57-b8ff-17054f8fa34e","name":"ЦИК России","kind":"national"},{"id":"735480c7-2bca-42a9-88e6-c94f3cf89748","name":"Волгоградская область","kind":"region"},{"id":"e63b554b-706d-427e-a2d3-f2e69e0ec3e1","name":"Волгоградская область – Волжский","kind":"district"},{"id":"b7515f6f-70cc-448d-9866-baf41884dd44","name":"Среднеахтубинская","kind":"territorial_commission"}]},"ballot":{"id":"protocol-1","title":"Выборы депутатов Государственной Думы Федерального Собрания Российской Федерации девятого созыва","kind":"single_member"},"turnout":{"registered":296,"issued":173,"valid":170,"invalid":3},"results":[{"entity":{"id":"entity-c9bbf14b56","name":"Долгов Валерий Евгеньевич","type":"candidate"},"votes":17},{"entity":{"id":"entity-51d3efe8b3","name":"Игнатов Дмитрий Евгеньевич","type":"candidate"},"votes":8},{"entity":{"id":"entity-37c36375e3","name":"Кравцов Виталий Сергеевич","type":"candidate"},"votes":13},{"entity":{"id":"entity-a81ab18ab5","name":"Литвинов Роман Александрович","type":"candidate"},"votes":5},{"entity":{"id":"entity-0542897c7f","name":"Лихачев Виталий Викторович","type":"candidate"},"votes":93},{"entity":{"id":"entity-24083a88bf","name":"Усков Денис Вячеславович","type":"candidate"},"votes":34}]}
