{"standard":"vibori-election-result/v1","source":{"url":"http://apps.cikrf.ru/service/ik-inp-service-pbcopy/reports/242?commissionClassifierId=f91f8eae-07d8-4b8b-901a-e5e5e37b2b58&protocolNum=1","retrieved_at":"2026-09-22T06:34:49.505791+00:00","publisher":"Central Election Commission of Russia"},"election":{"id":"izbirkom-587813923-p1","name":"Выборы депутатов Государственной Думы Федерального Собрания Российской Федерации девятого созыва","country":"RU","date":"2026-09-20","scope":"national"},"unit":{"id":"f91f8eae-07d8-4b8b-901a-e5e5e37b2b58","name":"УИК №4513","number":"4513","kind":"precinct","administrative_path":[{"id":"f0130cef-663a-4c57-b8ff-17054f8fa34e","name":"ЦИК России","kind":"national"},{"id":"735480c7-2bca-42a9-88e6-c94f3cf89748","name":"Волгоградская область","kind":"region"},{"id":"51877e5e-2483-4125-900e-ed9b75ba178f","name":"Волгоградская область – Михайловский","kind":"district"},{"id":"b708dd1c-2838-4f23-a83a-7733099c5fc1","name":"Урюпинская","kind":"territorial_commission"}]},"ballot":{"id":"protocol-1","title":"Выборы депутатов Государственной Думы Федерального Собрания Российской Федерации девятого созыва","kind":"single_member"},"turnout":{"registered":232,"issued":163,"valid":156,"invalid":7},"results":[{"entity":{"id":"entity-b5b2d7fd24","name":"Аветисян Самвел Гайкасович","type":"candidate"},"votes":20},{"entity":{"id":"entity-da10792cbe","name":"Баранов Виталий Геннадьевич","type":"candidate"},"votes":13},{"entity":{"id":"entity-e5f8c130c0","name":"Гимбатов Андрей Петрович","type":"candidate"},"votes":72},{"entity":{"id":"entity-1a8be8d3bd","name":"Кареликов Евгений Андреевич","type":"candidate"},"votes":10},{"entity":{"id":"entity-8855bc3f6e","name":"Кононенко Алексей Юрьевич","type":"candidate"},"votes":10},{"entity":{"id":"entity-f71bd629f4","name":"Могильный Валерий Федорович","type":"candidate"},"votes":31}]}
