{"standard":"vibori-election-result/v1","source":{"url":"http://apps.cikrf.ru/service/ik-inp-service-pbcopy/reports/242?commissionClassifierId=83c41f7e-f309-4e5e-be87-475651da52ea&protocolNum=1","retrieved_at":"2026-09-22T06:18:48.931435+00:00","publisher":"Central Election Commission of Russia"},"election":{"id":"izbirkom-587813923-p1","name":"Выборы депутатов Государственной Думы Федерального Собрания Российской Федерации девятого созыва","country":"RU","date":"2026-09-20","scope":"national"},"unit":{"id":"83c41f7e-f309-4e5e-be87-475651da52ea","name":"УИК №103","number":"103","kind":"precinct","administrative_path":[{"id":"f0130cef-663a-4c57-b8ff-17054f8fa34e","name":"ЦИК России","kind":"national"},{"id":"9a542082-c86a-42a2-a2c9-8ffe74737c00","name":"Пермский край","kind":"region"},{"id":"484ba8af-c34c-4298-9e5c-79b0754a9b23","name":"Пермский край – Чусовской","kind":"district"},{"id":"c42e39dd-16f5-4c9a-adeb-eb0a433daebc","name":"Александровская","kind":"territorial_commission"}]},"ballot":{"id":"protocol-1","title":"Выборы депутатов Государственной Думы Федерального Собрания Российской Федерации девятого созыва","kind":"single_member"},"turnout":{"registered":402,"issued":96,"valid":91,"invalid":5},"results":[{"entity":{"id":"entity-03ba343453","name":"Автухович Галина Эдуардовна","type":"candidate"},"votes":6},{"entity":{"id":"entity-2a522d98b1","name":"Айтакова Ксения Алексеевна","type":"candidate"},"votes":41},{"entity":{"id":"entity-e0f325732c","name":"Водянов Роман Михайлович","type":"candidate"},"votes":25},{"entity":{"id":"entity-c5ab823618","name":"Ермаков Егор Сергеевич","type":"candidate"},"votes":1},{"entity":{"id":"entity-b53718ff4b","name":"Исаев Сергей Юрьевич","type":"candidate"},"votes":10},{"entity":{"id":"entity-c9e23e192e","name":"Кобелев Андрей Геннадьевич","type":"candidate"},"votes":2},{"entity":{"id":"entity-ba8b3bf3e9","name":"Ляшков Андрей Владимирович","type":"candidate"},"votes":2},{"entity":{"id":"entity-41ebcdbc1a","name":"Сирдюченко Юрий Петрович","type":"candidate"},"votes":4}]}
