{"standard":"vibori-election-result/v1","source":{"url":"http://apps.cikrf.ru/service/ik-inp-service-pbcopy/reports/242?commissionClassifierId=8fdaa5df-fecf-460d-bed5-2d959e56794b&protocolNum=1","retrieved_at":"2026-09-22T05:59:29.057530+00:00","publisher":"Central Election Commission of Russia"},"election":{"id":"izbirkom-587813923-p1","name":"Выборы депутатов Государственной Думы Федерального Собрания Российской Федерации девятого созыва","country":"RU","date":"2026-09-20","scope":"national"},"unit":{"id":"8fdaa5df-fecf-460d-bed5-2d959e56794b","name":"УИК №1253","number":"1253","kind":"precinct","administrative_path":[{"id":"f0130cef-663a-4c57-b8ff-17054f8fa34e","name":"ЦИК России","kind":"national"},{"id":"d31e0004-3eb2-4bec-8c64-1b3a4e4b6798","name":"Республика Татарстан (Татарстан)","kind":"region"},{"id":"c8523ef5-1574-4518-8cb0-8d1e0da89ef8","name":"Республика Татарстан (Татарстан) – Московский","kind":"district"},{"id":"241c06ec-294a-4a59-97dd-ea889e9f681c","name":"Верхнеуслонская","kind":"territorial_commission"}]},"ballot":{"id":"protocol-1","title":"Выборы депутатов Государственной Думы Федерального Собрания Российской Федерации девятого созыва","kind":"single_member"},"turnout":{"registered":711,"issued":634,"valid":625,"invalid":9},"results":[{"entity":{"id":"entity-f211951091","name":"Айдуганова Ольга Вячеславовна","type":"candidate"},"votes":147},{"entity":{"id":"entity-ddb5165fbd","name":"Комисаров Александр Владимирович","type":"candidate"},"votes":92},{"entity":{"id":"entity-048b29f915","name":"Салахов Ренат Жамилевич","type":"candidate"},"votes":22},{"entity":{"id":"entity-058dd0e321","name":"Хуснутдинов Дамир Фаязович","type":"candidate"},"votes":33},{"entity":{"id":"entity-1ad9f5a4a5","name":"Юсупов Руслан Рафаилевич","type":"candidate"},"votes":331}]}
