{"standard":"vibori-election-result/v1","source":{"url":"http://apps.cikrf.ru/service/ik-inp-service-pbcopy/reports/242?commissionClassifierId=9e28162a-07d6-4025-8b4f-d54080765a61&protocolNum=1","retrieved_at":"2026-09-22T07:32:48.631068+00:00","publisher":"Central Election Commission of Russia"},"election":{"id":"izbirkom-587813923-p1","name":"Выборы депутатов Государственной Думы Федерального Собрания Российской Федерации девятого созыва","country":"RU","date":"2026-09-20","scope":"national"},"unit":{"id":"9e28162a-07d6-4025-8b4f-d54080765a61","name":"УИК №730","number":"730","kind":"precinct","administrative_path":[{"id":"f0130cef-663a-4c57-b8ff-17054f8fa34e","name":"ЦИК России","kind":"national"},{"id":"12742a64-87e6-42c0-93cc-1d93b2a3b539","name":"Смоленская область","kind":"region"},{"id":"f4247d6d-ee00-402a-b8e1-aeb954f81843","name":"Смоленская область – Смоленский","kind":"district"},{"id":"25af1243-8b99-4a0f-9bcd-d53f3e31df1e","name":"Холм-Жирковская","kind":"territorial_commission"}]},"ballot":{"id":"protocol-1","title":"Выборы депутатов Государственной Думы Федерального Собрания Российской Федерации девятого созыва","kind":"single_member"},"turnout":{"registered":1257,"issued":766,"valid":745,"invalid":21},"results":[{"entity":{"id":"entity-b0910e40a0","name":"Бабаков Александр Михайлович","type":"candidate"},"votes":453},{"entity":{"id":"entity-e2d5679e5f","name":"Войтов Алексей Михайлович","type":"candidate"},"votes":49},{"entity":{"id":"entity-6a32aa11f0","name":"Емельянов Степан Владимирович","type":"candidate"},"votes":106},{"entity":{"id":"entity-a581eafb46","name":"Ковалев Михаил Александрович","type":"candidate"},"votes":36},{"entity":{"id":"entity-f476fc1d40","name":"Рябенков Илья Владимирович","type":"candidate"},"votes":7},{"entity":{"id":"entity-cfe754a274","name":"Шаврикова Дарья Сергеевна","type":"candidate"},"votes":12},{"entity":{"id":"entity-9468114bc2","name":"Якимов Сергей Сергеевич","type":"candidate"},"votes":82}]}
